id|information_name|information_description|information_icon|information_endpoint|data_paths|is_array|sequence_number|created_by|css_style|is_desktop
1|Dashboards|Get count of all dashboards you have access to|#dashboards|api/dashboards/count|count|false|0|flairadmin|background:#337ab7;color:white;border:thick solid#337ab7;|true
2|Views|Get count of all views you have access to|#views|api/views/count|count|false|1|flairadmin|background:#64cb64;color:white;border:thick solid #64cb64;|true
3|Datasources|Get count of all datasources you have access to|#datasources|api/datasources/count|count|false|2|flairadmin|background:purple;color:white;border:thick solid purple;|true
4|Flair Insights|Get count of all Alerts|#flair-insights|api/schedule/reports/count|count|false|3|flairadmin|background:gray;color:white;border:thick solid gray;|true
5|Bookmarks|Get count of all recent created bookmarks you have|#bookmarks|api/bookmark-watches/recently-created/count|count|false|4|flairadmin|background:gray;color:white;border:thick solid gray;|true
6|Recent Dashboards|Get count of all recent  dashboards you have|#dashboards|api/dashboards/count|count|false|5|flairadmin|background:gray;color:white;border:thick solid gray;|false
7|Recent Views|Get count of all recent created bookmarks you have|#views|api/views/count|count|false|6|flairadmin|background:gray;color:white;border:thick solid gray;|false
8|Recent Bookmarks|Get count of all recent created bookmarks you have|#bookmarks|api/bookmark-watches/recently-created/count|count|false|7|flairadmin|background:gray;color:white;border:thick solid gray;|false
